{
  "$schema": "https://json-schema.org/draft/2020-12/schema",
  "title": "Scenario",
  "description": "The full scenario: blueprint, run length, and snapshot schedule.",
  "type": "object",
  "properties": {
    "entities": {
      "description": "The placed entities, in placement order (= output order).",
      "type": "array",
      "items": {
        "$ref": "#/$defs/Entity"
      }
    },
    "grid": {
      "description": "The tile grid.",
      "$ref": "#/$defs/Grid"
    },
    "snapshots": {
      "description": "The ticks at which to emit canonical state. Strictly ascending, each\n`> 0` and `<= ticks`.",
      "type": "array",
      "items": {
        "type": "integer",
        "format": "uint64",
        "minimum": 0
      }
    },
    "ticks": {
      "description": "Simulate this many ticks from an empty start.",
      "type": "integer",
      "format": "uint64",
      "minimum": 0
    },
    "version": {
      "description": "The wire version; must equal [`SCENARIO_VERSION`].",
      "type": "integer",
      "format": "uint32",
      "minimum": 0
    }
  },
  "additionalProperties": false,
  "required": [
    "version",
    "grid",
    "ticks",
    "snapshots",
    "entities"
  ],
  "$defs": {
    "Dir": {
      "description": "A cardinal direction. The grid is `x` rightward (E = +x) and `y` downward\n(S = +y); the canonical orientation in any reference material is flow-east.",
      "oneOf": [
        {
          "description": "North: `y - 1`.",
          "type": "string",
          "const": "N"
        },
        {
          "description": "South: `y + 1`.",
          "type": "string",
          "const": "S"
        },
        {
          "description": "East: `x + 1`.",
          "type": "string",
          "const": "E"
        },
        {
          "description": "West: `x - 1`.",
          "type": "string",
          "const": "W"
        }
      ]
    },
    "Entity": {
      "description": "One placed entity. Internally tagged on `type`, so the JSON reads\n`{ \"type\": \"belt\", \"x\": .., .. }`. Each variant carries only its\ntype-specific fields (serde's internally-tagged representation does not\nsupport per-variant `deny_unknown_fields`, so an entity is matched on the\nfields it declares).",
      "oneOf": [
        {
          "description": "A two-lane transport belt occupying one tile, facing `dir`, of belt\n`tier`.",
          "type": "object",
          "properties": {
            "dir": {
              "$ref": "#/$defs/Dir"
            },
            "tier": {
              "description": "A belt tier name from the prototype table (`\"slow\"`/`\"fast\"`/\n`\"express\"`).",
              "type": "string"
            },
            "type": {
              "type": "string",
              "const": "belt"
            },
            "x": {
              "type": "integer",
              "format": "int32"
            },
            "y": {
              "type": "integer",
              "format": "int32"
            }
          },
          "required": [
            "type",
            "x",
            "y",
            "dir",
            "tier"
          ]
        },
        {
          "description": "A two-tile balancer. Anchored at `(x, y)`; its second tile is one step\nperpendicular-clockwise of `dir` (for E/W: `(x, y+1)`; for N/S:\n`(x+1, y)`).",
          "type": "object",
          "properties": {
            "dir": {
              "$ref": "#/$defs/Dir"
            },
            "type": {
              "type": "string",
              "const": "splitter"
            },
            "x": {
              "type": "integer",
              "format": "int32"
            },
            "y": {
              "type": "integer",
              "format": "int32"
            }
          },
          "required": [
            "type",
            "x",
            "y",
            "dir"
          ]
        },
        {
          "description": "A swing arm. Picks up from the tile *behind* it and drops onto the tile\n*in front*, set by `dir`.\nThere is one kind of inserter, so this carries no tier — every inserter\nswings at the single `SWING` constant from the prototype table.",
          "type": "object",
          "properties": {
            "dir": {
              "$ref": "#/$defs/Dir"
            },
            "type": {
              "type": "string",
              "const": "inserter"
            },
            "x": {
              "type": "integer",
              "format": "int32"
            },
            "y": {
              "type": "integer",
              "format": "int32"
            }
          },
          "required": [
            "type",
            "x",
            "y",
            "dir"
          ]
        },
        {
          "description": "A 3×3 crafting machine anchored at `(x, y)`, covering `(x..x+3, y..y+3)`.\nRuns any **non-smelting** recipe (gears, cable, circuits, machines).",
          "type": "object",
          "properties": {
            "recipe": {
              "description": "A recipe name from the prototype table (`\"iron-gear\"`, …).",
              "type": "string"
            },
            "type": {
              "type": "string",
              "const": "assembler"
            },
            "x": {
              "type": "integer",
              "format": "int32"
            },
            "y": {
              "type": "integer",
              "format": "int32"
            }
          },
          "required": [
            "type",
            "x",
            "y",
            "recipe"
          ]
        },
        {
          "description": "A 2×2 coal-fired smelter anchored at `(x, y)`, covering `(x..x+2, y..y+2)`.\nA furnace is the only machine that runs a **smelting** recipe\n(`\"iron-plate\"` / `\"copper-plate\"`), turning raw ore into a plate by burning\ncoal; it has a smaller footprint than the assembler and never smelts without\ncoal in its buffer.",
          "type": "object",
          "properties": {
            "recipe": {
              "description": "A smelting recipe name from the prototype table.",
              "type": "string"
            },
            "type": {
              "type": "string",
              "const": "furnace"
            },
            "x": {
              "type": "integer",
              "format": "int32"
            },
            "y": {
              "type": "integer",
              "format": "int32"
            }
          },
          "required": [
            "type",
            "x",
            "y",
            "recipe"
          ]
        },
        {
          "description": "A test fixture that emits `item` onto `lane` of the downstream belt once\nevery `period` ticks, respecting compaction (it stalls when the gap is too\nsmall). Infinite supply.",
          "type": "object",
          "properties": {
            "dir": {
              "$ref": "#/$defs/Dir"
            },
            "item": {
              "description": "The item id this source emits (from the prototype item table).",
              "type": "string"
            },
            "lane": {
              "description": "Which lane(s) of the downstream belt to emit onto.",
              "$ref": "#/$defs/Lane"
            },
            "period": {
              "description": "Ticks between emissions. An emission is attempted on every tick `t`\nwith `t > 0 && t % period == 0`.",
              "type": "integer",
              "format": "uint32",
              "minimum": 0
            },
            "type": {
              "type": "string",
              "const": "source"
            },
            "x": {
              "type": "integer",
              "format": "int32"
            },
            "y": {
              "type": "integer",
              "format": "int32"
            }
          },
          "required": [
            "type",
            "x",
            "y",
            "dir",
            "item",
            "lane",
            "period"
          ]
        },
        {
          "description": "A test fixture that consumes and counts every item that reaches it.",
          "type": "object",
          "properties": {
            "dir": {
              "$ref": "#/$defs/Dir"
            },
            "type": {
              "type": "string",
              "const": "sink"
            },
            "x": {
              "type": "integer",
              "format": "int32"
            },
            "y": {
              "type": "integer",
              "format": "int32"
            }
          },
          "required": [
            "type",
            "x",
            "y",
            "dir"
          ]
        }
      ]
    },
    "Grid": {
      "description": "The grid the scenario plays out on. Each tile holds at most one entity.",
      "type": "object",
      "properties": {
        "height": {
          "description": "Grid height in tiles.",
          "type": "integer",
          "format": "int32"
        },
        "width": {
          "description": "Grid width in tiles.",
          "type": "integer",
          "format": "int32"
        }
      },
      "additionalProperties": false,
      "required": [
        "width",
        "height"
      ]
    },
    "Lane": {
      "description": "Which lane(s) of a belt a fixture acts on. `left`/`right` are relative to the\ndirection of travel: for an E-facing belt the left lane is the `-y` (north)\nside and the right lane is the `+y` (south) side; the other facings rotate\nthat convention. `both` means act on left then right independently.",
      "oneOf": [
        {
          "description": "The left lane relative to the direction of travel.",
          "type": "string",
          "const": "left"
        },
        {
          "description": "The right lane relative to the direction of travel.",
          "type": "string",
          "const": "right"
        },
        {
          "description": "Both lanes (left then right, independently).",
          "type": "string",
          "const": "both"
        }
      ]
    }
  }
}
