{
  "version": 1,
  "grid": { "width": 20, "height": 16 },
  "ticks": 30000,
  "snapshots": [6000, 15000, 30000],
  "entities": [
    { "type": "source", "x": 0, "y": 2, "dir": "E", "item": "iron-plate", "lane": "both", "period": 8 },
    { "type": "belt", "x": 1, "y": 2, "dir": "E", "tier": "fast" },
    { "type": "belt", "x": 2, "y": 2, "dir": "E", "tier": "fast" },
    { "type": "inserter", "x": 2, "y": 3, "dir": "S", "tier": "base" },
    { "type": "source", "x": 0, "y": 8, "dir": "E", "item": "copper-cable", "lane": "both", "period": 3 },
    { "type": "belt", "x": 1, "y": 8, "dir": "E", "tier": "fast" },
    { "type": "belt", "x": 2, "y": 8, "dir": "E", "tier": "fast" },
    { "type": "inserter", "x": 2, "y": 7, "dir": "N", "tier": "fast" },
    { "type": "assembler", "x": 2, "y": 4, "recipe": "circuit" },
    { "type": "inserter", "x": 5, "y": 5, "dir": "E", "tier": "fast" },
    { "type": "belt", "x": 6, "y": 5, "dir": "E", "tier": "slow" },
    { "type": "belt", "x": 7, "y": 5, "dir": "E", "tier": "slow" },
    { "type": "sink", "x": 8, "y": 5, "dir": "E" }
  ]
}
