{
  "version": 1,
  "grid": {
    "width": 10,
    "height": 8
  },
  "ticks": 600,
  "snapshots": [
    200,
    400,
    600
  ],
  "entities": [
    {
      "type": "source",
      "x": 0,
      "y": 3,
      "dir": "E",
      "item": "iron-plate",
      "lane": "both",
      "period": 2
    },
    {
      "type": "belt",
      "x": 1,
      "y": 3,
      "dir": "E",
      "tier": "fast"
    },
    {
      "type": "belt",
      "x": 2,
      "y": 3,
      "dir": "E",
      "tier": "fast"
    },
    {
      "type": "inserter",
      "x": 3,
      "y": 3,
      "dir": "E"
    },
    {
      "type": "source",
      "x": 5,
      "y": 0,
      "dir": "S",
      "item": "copper-cable",
      "lane": "both",
      "period": 1
    },
    {
      "type": "belt",
      "x": 5,
      "y": 1,
      "dir": "S",
      "tier": "fast"
    },
    {
      "type": "inserter",
      "x": 5,
      "y": 2,
      "dir": "S"
    },
    {
      "type": "assembler",
      "x": 4,
      "y": 3,
      "recipe": "circuit"
    },
    {
      "type": "inserter",
      "x": 7,
      "y": 4,
      "dir": "E"
    },
    {
      "type": "sink",
      "x": 8,
      "y": 4,
      "dir": "W"
    }
  ]
}
