{
  "version": 1,
  "grid": {
    "width": 10,
    "height": 5
  },
  "ticks": 300,
  "snapshots": [
    100,
    200,
    300
  ],
  "entities": [
    {
      "type": "source",
      "x": 0,
      "y": 2,
      "dir": "E",
      "item": "iron-ore",
      "lane": "both",
      "period": 3
    },
    {
      "type": "belt",
      "x": 1,
      "y": 2,
      "dir": "E",
      "tier": "fast"
    },
    {
      "type": "belt",
      "x": 2,
      "y": 2,
      "dir": "E",
      "tier": "fast"
    },
    {
      "type": "inserter",
      "x": 3,
      "y": 2,
      "dir": "E"
    },
    {
      "type": "assembler",
      "x": 4,
      "y": 1,
      "recipe": "iron-plate"
    },
    {
      "type": "inserter",
      "x": 7,
      "y": 2,
      "dir": "E"
    },
    {
      "type": "sink",
      "x": 8,
      "y": 2,
      "dir": "W"
    }
  ]
}
